drive_file_id	title	mime_type	size_bytes	status	doc_slug_or_dash
1w5Z6Cku8CWPaUGvK09zwWmxupIVPOhFl	Graded coating inspection using laser generated surface acoustic waves  - OO Balogun (2004).pdf	application/pdf	710845	read	graded-coating-inspection-laser-saw
1H3BOuAo0Jp2J1Ueo28HuBTjyR5YrbIDi	Pulse-echo measurement of longitudinal sound velocity in nanometer thin films - (2006) .pdf	application/pdf	241662	read	pulse-echo-sound-velocity-nanofilms
1hIOTG6Xr3ENg9oJ6VYJYyD9GUlE8f4q3	Some applications of laser ultrasound - (1988)C B Scruby .pdf	application/pdf	2346368	read	some-applications-laser-ultrasound-scruby
10aJPh1-oiK4AxAdcYzU06WTOLq1cwY9J	Precision laser-ultrasonic velocity measurement and elastic constant determination.pdf	application/pdf	1618480	read	precision-laser-ultrasonic-velocity-elastic-constants
19jSaohmPYUb6l9hHNu1rcR-R7-R-CeNg	Non-contact ultrasonic techniques - (2004) Robert E Green Jr.pdf	application/pdf	927386	read	non-contact-ultrasonic-techniques-green
1KoFkx8o6HbXd7eU_9mW5S0QdLmnfa-T9	Directivity patterns of laser-generated sound in solids - effects of optical and thermal parameters.pdf	application/pdf	132604	read	directivity-laser-generated-sound-krylov
